{
  "skill_id": "skl_translate",
  "uri": "nexus://skill/skl_translate",
  "name": "Translate",
  "description": "Faithful translation into a target language preserving structure and register, with a glossary of domain terms and notes on ambiguities.",
  "origin": "platform",
  "status": "published",
  "version": "1.0.0",
  "entry": "SKILL.md",
  "tenancy": {
    "enterprise_id": "nexus",
    "tenant_id": "platform"
  },
  "shortcut": "/translate",
  "metadata": {
    "tags": [
      "translation"
    ]
  },
  "evaluation": {
    "human_review": {
      "state": "approved",
      "reviewed_by": "Nexi maintainers",
      "reviewed_at": "2026-09-17T00:00:00Z",
      "reviewed_version": "1.0.0"
    }
  },
  "security_review": {
    "state": "not_required"
  },
  "governance": {
    "state": "approved",
    "reviewed_at": "2026-09-17T00:00:00Z"
  },
  "created_by": "nexus-platform",
  "created_at": "2026-09-17T00:00:00Z",
  "published_at": "2026-09-17T00:00:00Z",
  "input_schema": {
    "type": "object",
    "additionalProperties": false,
    "properties": {
      "text": {
        "type": "string"
      },
      "target_language": {
        "type": "string",
        "description": "BCP 47 tag, e.g. uk, en, de"
      }
    },
    "required": [
      "text",
      "target_language"
    ]
  },
  "output_schema": {
    "type": "object",
    "additionalProperties": false,
    "properties": {
      "translation": {
        "type": "string"
      },
      "source_language": {
        "type": "string"
      },
      "glossary": {
        "type": "array",
        "items": {
          "type": "object",
          "additionalProperties": false,
          "properties": {
            "source": {
              "type": "string"
            },
            "target": {
              "type": "string"
            }
          },
          "required": [
            "source",
            "target"
          ]
        },
        "maxItems": 100
      },
      "notes": {
        "type": "array",
        "items": {
          "type": "string"
        },
        "maxItems": 20
      }
    },
    "required": [
      "translation",
      "source_language",
      "glossary",
      "notes"
    ]
  },
  "examples": [
    {
      "title": "Policy paragraph → Ukrainian",
      "input": {
        "text": "Access is granted on a need-to-know basis.",
        "target_language": "uk"
      },
      "expected_output": "{\"translation\": \"Доступ надається за принципом службової необхідності.\", \"source_language\": \"en\", \"glossary\": [{\"source\": \"need-to-know\", \"target\": \"службова необхідність\"}], \"notes\": []}"
    }
  ]
}
